{
  "$schema": "https://example.invalid/ai-migration-framework/schemas/migration-scope.schema.json",
  "schema_version": "3.0",
  "migration_id": "replace-me",
  "policy": {
    "mode": "whole-source-root",
    "required_claim": "migrated",
    "allow_approved_removals": false,
    "boundary_decisions": []
  },
  "source_snapshot": {
    "source_root": "replace-with-source-root",
    "revision": null,
    "captured_at": "1970-01-01T00:00:00Z",
    "digest": "0000000000000000000000000000000000000000000000000000000000000000",
    "files": [],
    "excluded_files": []
  },
  "units": []
}
